{
  "corpus_family_id": "research.solver_assurance.r0",
  "corpus_version": "r0-v0.4.0",
  "expected_regime": "active_set_neighborhood_perturbation",
  "extras": {
    "constraint_family": "box",
    "disagreement_regime": "active_set_neighborhood",
    "fault_injection": true,
    "fault_injection_kind": "shadow_iteration_limit_at_boundary",
    "fault_injection_label": "shadow_iteration_limit_at_boundary",
    "fault_injection_notes": "boundary neighborhood + shadow iter starve",
    "pre_transition": true,
    "shadow_overrides": {
      "suggested_max_iter": 2,
      "suggested_time_limit": 1e-08
    }
  },
  "family": "consequential_disagreement_regimes",
  "generation_commit": "55324d02a0a4e888",
  "notes": "Active-set neighborhood just below box activation; paired with shadow iteration starve for compound disagreement.",
  "previous_action": [
    0.25,
    0.25,
    0.25,
    0.25
  ],
  "proposed_action": [
    0.55,
    0.15,
    0.15,
    0.15
  ],
  "reference_action": [
    0.25,
    0.25,
    0.25,
    0.25
  ],
  "scenario_id": "consequential_disagreement_regimes/s1604",
  "seed": 1604,
  "spec": {
    "action_dim": 4,
    "constraints": [
      {
        "kind": "simplex",
        "total": 1.0
      },
      {
        "allowed_actions": [
          0,
          1,
          2,
          3
        ],
        "kind": "turn_feasibility"
      },
      {
        "kind": "box",
        "lower": [
          0.0,
          0.0,
          0.0,
          0.0
        ],
        "upper": [
          0.495,
          1.0,
          1.0,
          1.0
        ]
      },
      {
        "kind": "rate",
        "max_delta": [
          1.0,
          1.0,
          1.0,
          1.0
        ]
      }
    ],
    "slack_weight": 10.0,
    "spec_id": "research/consequential_disagreement_regimes/active_set_nbhd",
    "version": "0.1.0"
  },
  "weights": {
    "policy_weight": 1.0,
    "reference_weight": 0.0
  }
}
