{
  "corpus_family_id": "research.solver_assurance.r0",
  "corpus_version": "r0-v0.4.0",
  "expected_regime": "active_set_transition_neighborhood",
  "extras": {
    "bound_param": 0.29,
    "constraint_family": "rate",
    "disagreement_regime": "rate_neighborhood",
    "pre_transition": true,
    "side": "tight",
    "trajectory_id": "rate_max_delta"
  },
  "family": "active_set_transition_neighborhoods",
  "generation_commit": "55324d02a0a4e888",
  "notes": "Rate-limit trajectory; max_delta=0.29.",
  "previous_action": [
    0.4,
    0.2,
    0.2,
    0.2
  ],
  "proposed_action": [
    0.7,
    0.1,
    0.1,
    0.1
  ],
  "reference_action": [
    0.4,
    0.2,
    0.2,
    0.2
  ],
  "scenario_id": "active_set_transition_neighborhoods/s1104",
  "seed": 1104,
  "spec": {
    "action_dim": 4,
    "constraints": [
      {
        "kind": "simplex",
        "total": 1.0
      },
      {
        "allowed_actions": [
          0,
          1,
          2,
          3
        ],
        "kind": "turn_feasibility"
      },
      {
        "kind": "box",
        "lower": [
          0.0,
          0.0,
          0.0,
          0.0
        ],
        "upper": [
          1.0,
          1.0,
          1.0,
          1.0
        ]
      },
      {
        "kind": "rate",
        "max_delta": [
          0.29,
          0.29,
          0.29,
          0.29
        ]
      }
    ],
    "slack_weight": 10.0,
    "spec_id": "research/active_set_transition_neighborhoods/rate",
    "version": "0.1.0"
  },
  "weights": {
    "policy_weight": 1.0,
    "reference_weight": 0.0
  }
}
