{
  "corpus_family_id": "research.solver_assurance.r0",
  "corpus_version": "r0-v0.3.0",
  "expected_regime": "timeout_or_iteration_limit",
  "extras": {
    "suggested_max_iter": 1,
    "suggested_time_limit": 1e-09
  },
  "family": "solver_timeout_iteration_limit",
  "generation_commit": "bbd3dcffd9af8bfa",
  "notes": "Harness should apply tiny max_iter / time_limit.",
  "previous_action": [
    0.25,
    0.25,
    0.25,
    0.25
  ],
  "proposed_action": [
    0.4,
    0.3,
    0.2,
    0.1
  ],
  "reference_action": [
    0.25,
    0.25,
    0.25,
    0.25
  ],
  "scenario_id": "solver_timeout_iteration_limit/s1101",
  "seed": 1101,
  "spec": {
    "action_dim": 4,
    "constraints": [
      {
        "kind": "simplex",
        "total": 1.0
      },
      {
        "allowed_actions": [
          0,
          1,
          2,
          3
        ],
        "kind": "turn_feasibility"
      },
      {
        "kind": "box",
        "lower": [
          0.0,
          0.0,
          0.0,
          0.0
        ],
        "upper": [
          1.0,
          1.0,
          1.0,
          1.0
        ]
      },
      {
        "kind": "rate",
        "max_delta": [
          1.0,
          1.0,
          1.0,
          1.0
        ]
      }
    ],
    "slack_weight": 10.0,
    "spec_id": "research/solver_timeout_iteration_limit",
    "version": "0.1.0"
  },
  "weights": {
    "policy_weight": 1.0,
    "reference_weight": 0.0
  }
}
