{
  "corpus_family_id": "research.solver_assurance.r0",
  "corpus_version": "r0-v0.3.0",
  "expected_regime": "active_set_transition_neighborhood",
  "extras": {
    "bound_param": 4.0,
    "constraint_family": "turn_feasibility",
    "disagreement_regime": "admissibility_change",
    "pre_transition": false,
    "side": "full",
    "trajectory_id": "admissibility_mask"
  },
  "family": "active_set_transition_neighborhoods",
  "generation_commit": "bbd3dcffd9af8bfa",
  "notes": "Admissibility trajectory; mask=full.",
  "previous_action": [
    0.25,
    0.25,
    0.25,
    0.25
  ],
  "proposed_action": [
    0.4,
    0.3,
    0.2,
    0.1
  ],
  "reference_action": [
    0.25,
    0.25,
    0.25,
    0.25
  ],
  "scenario_id": "active_set_transition_neighborhoods/s1200",
  "seed": 1200,
  "spec": {
    "action_dim": 4,
    "constraints": [
      {
        "kind": "simplex",
        "total": 1.0
      },
      {
        "allowed_actions": [
          0,
          1,
          2,
          3
        ],
        "kind": "turn_feasibility"
      },
      {
        "kind": "box",
        "lower": [
          0.0,
          0.0,
          0.0,
          0.0
        ],
        "upper": [
          1.0,
          1.0,
          1.0,
          1.0
        ]
      },
      {
        "kind": "rate",
        "max_delta": [
          1.0,
          1.0,
          1.0,
          1.0
        ]
      }
    ],
    "slack_weight": 10.0,
    "spec_id": "research/active_set_transition_neighborhoods/mask",
    "version": "0.1.0"
  },
  "weights": {
    "policy_weight": 1.0,
    "reference_weight": 0.0
  }
}
