{
  "corpus_family_id": "research.solver_assurance.r0",
  "corpus_version": "r0-v0.3.0",
  "expected_regime": "rate_limited",
  "family": "rate_limited_transitions",
  "generation_commit": "bbd3dcffd9af8bfa",
  "notes": "Tight rate limits force gradual transition.",
  "previous_action": [
    0.25,
    0.25,
    0.25,
    0.25
  ],
  "proposed_action": [
    0.7,
    0.1,
    0.1,
    0.1
  ],
  "reference_action": [
    0.25,
    0.25,
    0.25,
    0.25
  ],
  "scenario_id": "rate_limited_transitions/s0501",
  "seed": 501,
  "spec": {
    "action_dim": 4,
    "constraints": [
      {
        "kind": "simplex",
        "total": 1.0
      },
      {
        "allowed_actions": [
          0,
          1,
          2,
          3
        ],
        "kind": "turn_feasibility"
      },
      {
        "kind": "box",
        "lower": [
          0.0,
          0.0,
          0.0,
          0.0
        ],
        "upper": [
          1.0,
          1.0,
          1.0,
          1.0
        ]
      },
      {
        "kind": "rate",
        "max_delta": [
          0.05,
          0.05,
          0.05,
          0.05
        ]
      }
    ],
    "slack_weight": 10.0,
    "spec_id": "research/rate_limited_transitions",
    "version": "0.1.0"
  },
  "weights": {
    "policy_weight": 1.0,
    "reference_weight": 0.0
  }
}
