{
  "corpus_family_id": "research.solver_assurance.r0",
  "corpus_version": "r0-v0.3.0",
  "expected_regime": "sidecar_interruption",
  "extras": {
    "backend_stub": "windows_sidecar",
    "interrupt_policy": "hard_timeout"
  },
  "family": "sidecar_interruption",
  "generation_commit": "bbd3dcffd9af8bfa",
  "notes": "Stub regime for Windows-sidecar interruption studies (backend may be unavailable).",
  "previous_action": [
    0.25,
    0.25,
    0.25,
    0.25
  ],
  "proposed_action": [
    0.35,
    0.35,
    0.15,
    0.15
  ],
  "reference_action": [
    0.25,
    0.25,
    0.25,
    0.25
  ],
  "scenario_id": "sidecar_interruption/s1401",
  "seed": 1401,
  "spec": {
    "action_dim": 4,
    "constraints": [
      {
        "kind": "simplex",
        "total": 1.0
      },
      {
        "allowed_actions": [
          0,
          1,
          2,
          3
        ],
        "kind": "turn_feasibility"
      },
      {
        "kind": "box",
        "lower": [
          0.0,
          0.0,
          0.0,
          0.0
        ],
        "upper": [
          1.0,
          1.0,
          1.0,
          1.0
        ]
      },
      {
        "kind": "rate",
        "max_delta": [
          1.0,
          1.0,
          1.0,
          1.0
        ]
      }
    ],
    "slack_weight": 10.0,
    "spec_id": "research/sidecar_interruption",
    "version": "0.1.0"
  },
  "weights": {
    "policy_weight": 1.0,
    "reference_weight": 0.0
  }
}
