{
  "corpus_family_id": "research.solver_assurance.r0",
  "corpus_version": "r0-v0.3.0",
  "expected_regime": "simplex_corner",
  "family": "simplex_corner",
  "generation_commit": "bbd3dcffd9af8bfa",
  "notes": "Projection toward a simplex vertex.",
  "previous_action": [
    1.0,
    0.0,
    0.0,
    0.0
  ],
  "proposed_action": [
    1.2,
    -0.1,
    0.0,
    0.0
  ],
  "reference_action": [
    1.0,
    0.0,
    0.0,
    0.0
  ],
  "scenario_id": "simplex_corner/s0401",
  "seed": 401,
  "spec": {
    "action_dim": 4,
    "constraints": [
      {
        "kind": "simplex",
        "total": 1.0
      },
      {
        "allowed_actions": [
          0,
          1,
          2,
          3
        ],
        "kind": "turn_feasibility"
      },
      {
        "kind": "box",
        "lower": [
          0.0,
          0.0,
          0.0,
          0.0
        ],
        "upper": [
          1.0,
          1.0,
          1.0,
          1.0
        ]
      },
      {
        "kind": "rate",
        "max_delta": [
          1.0,
          1.0,
          1.0,
          1.0
        ]
      }
    ],
    "slack_weight": 10.0,
    "spec_id": "research/simplex_corner",
    "version": "0.1.0"
  },
  "weights": {
    "policy_weight": 1.0,
    "reference_weight": 0.0
  }
}
