{
  "corpus_family_id": "research.solver_assurance.r0",
  "corpus_version": "r0-v0.4.0",
  "expected_regime": "multiple_active_bounds",
  "family": "multiple_active_bounds",
  "generation_commit": "55324d02a0a4e888",
  "notes": "Two upper bounds expected active.",
  "previous_action": [
    0.25,
    0.25,
    0.25,
    0.25
  ],
  "proposed_action": [
    0.5,
    0.5,
    0.0,
    0.0
  ],
  "reference_action": [
    0.25,
    0.25,
    0.25,
    0.25
  ],
  "scenario_id": "multiple_active_bounds/s0301",
  "seed": 301,
  "spec": {
    "action_dim": 4,
    "constraints": [
      {
        "kind": "simplex",
        "total": 1.0
      },
      {
        "allowed_actions": [
          0,
          1,
          2,
          3
        ],
        "kind": "turn_feasibility"
      },
      {
        "kind": "box",
        "lower": [
          0.0,
          0.0,
          0.0,
          0.0
        ],
        "upper": [
          0.3,
          0.3,
          1.0,
          1.0
        ]
      },
      {
        "kind": "rate",
        "max_delta": [
          1.0,
          1.0,
          1.0,
          1.0
        ]
      }
    ],
    "slack_weight": 10.0,
    "spec_id": "research/multiple_active_bounds",
    "version": "0.1.0"
  },
  "weights": {
    "policy_weight": 1.0,
    "reference_weight": 0.0
  }
}
