{
  "corpus_family_id": "research.solver_assurance.r0",
  "corpus_version": "r0-v0.3.0",
  "expected_regime": "admissibility_mask",
  "family": "changing_admissibility_masks",
  "generation_commit": "bbd3dcffd9af8bfa",
  "notes": "Mask excludes actions 2 and 3.",
  "previous_action": [
    0.5,
    0.5,
    0.0,
    0.0
  ],
  "proposed_action": [
    0.4,
    0.4,
    0.1,
    0.1
  ],
  "reference_action": [
    0.5,
    0.5,
    0.0,
    0.0
  ],
  "scenario_id": "changing_admissibility_masks/s0601",
  "seed": 601,
  "spec": {
    "action_dim": 4,
    "constraints": [
      {
        "kind": "simplex",
        "total": 1.0
      },
      {
        "allowed_actions": [
          0,
          1
        ],
        "kind": "turn_feasibility"
      },
      {
        "kind": "box",
        "lower": [
          0.0,
          0.0,
          0.0,
          0.0
        ],
        "upper": [
          1.0,
          1.0,
          1.0,
          1.0
        ]
      },
      {
        "kind": "rate",
        "max_delta": [
          1.0,
          1.0,
          1.0,
          1.0
        ]
      }
    ],
    "slack_weight": 10.0,
    "spec_id": "research/changing_admissibility_masks",
    "version": "0.1.0"
  },
  "weights": {
    "policy_weight": 1.0,
    "reference_weight": 0.0
  }
}
