{
  "corpus_family_id": "research.solver_assurance.r0",
  "corpus_version": "r0-v0.4.0",
  "expected_regime": "near_infeasible",
  "family": "near_infeasible",
  "generation_commit": "55324d02a0a4e888",
  "notes": "Tight box+rate; residuals expected elevated.",
  "previous_action": [
    0.49,
    0.49,
    0.01,
    0.01
  ],
  "proposed_action": [
    0.45,
    0.45,
    0.05,
    0.05
  ],
  "reference_action": [
    0.45,
    0.45,
    0.05,
    0.05
  ],
  "scenario_id": "near_infeasible/s0701",
  "seed": 701,
  "spec": {
    "action_dim": 4,
    "constraints": [
      {
        "kind": "simplex",
        "total": 1.0
      },
      {
        "allowed_actions": [
          0,
          1,
          2,
          3
        ],
        "kind": "turn_feasibility"
      },
      {
        "kind": "box",
        "lower": [
          0.4,
          0.4,
          0.0,
          0.0
        ],
        "upper": [
          0.5,
          0.5,
          0.1,
          0.1
        ]
      },
      {
        "kind": "rate",
        "max_delta": [
          0.01,
          0.01,
          0.01,
          0.01
        ]
      }
    ],
    "slack_weight": 10.0,
    "spec_id": "research/near_infeasible",
    "version": "0.1.0"
  },
  "weights": {
    "policy_weight": 1.0,
    "reference_weight": 0.0
  }
}
