{
  "corpus_family_id": "research.solver_assurance.r0",
  "corpus_version": "r0-v0.4.0",
  "expected_regime": "fault_injection_warm_vs_cold",
  "extras": {
    "disagreement_regime": "warm_cold_asymmetry",
    "fault_injection": true,
    "fault_injection_kind": "shadow_warm_start_stale",
    "fault_injection_label": "shadow_warm_start_stale",
    "fault_injection_notes": "shadow warm_start=True with stale previous under new mask",
    "primary_overrides": {
      "warm_start": false
    },
    "shadow_overrides": {
      "warm_start": true
    },
    "warm_start_rejected": true
  },
  "family": "consequential_disagreement_regimes",
  "generation_commit": "55324d02a0a4e888",
  "notes": "Fault injection: shadow warm-starts from stale previous under a mask flip; primary stays cold.",
  "previous_action": [
    0.0,
    0.0,
    0.6,
    0.4
  ],
  "proposed_action": [
    0.7,
    0.3,
    0.0,
    0.0
  ],
  "reference_action": [
    0.5,
    0.5,
    0.0,
    0.0
  ],
  "scenario_id": "consequential_disagreement_regimes/s1603",
  "seed": 1603,
  "spec": {
    "action_dim": 4,
    "constraints": [
      {
        "kind": "simplex",
        "total": 1.0
      },
      {
        "allowed_actions": [
          0,
          1
        ],
        "kind": "turn_feasibility"
      },
      {
        "kind": "box",
        "lower": [
          0.0,
          0.0,
          0.0,
          0.0
        ],
        "upper": [
          1.0,
          1.0,
          1.0,
          1.0
        ]
      },
      {
        "kind": "rate",
        "max_delta": [
          1.0,
          1.0,
          1.0,
          1.0
        ]
      }
    ],
    "slack_weight": 10.0,
    "spec_id": "research/consequential_disagreement_regimes/warm_cold",
    "version": "0.1.0"
  },
  "weights": {
    "policy_weight": 1.0,
    "reference_weight": 0.0
  }
}
